### ISSUE TITLE
It Doesn't Work: DNS Traffic Not Routed Through Expected Port 443

### ISSUE THREAD

**Issue by limkokhole** [mansuf/requests-doh#6]
I'm facing an issue where my DNS traffic is still going through port 53 instead of the expected 443. Here's what I captured using tcpdump:

```
>>> from requests_doh import DNSOverHTTPSSession
>>> s = DNSOverHTTPSSession() 
>>> r = s.get('https://www.google.com/')
>>> 

$ sudo tcpdump -i wlo1 port 53
23:45:29.495342 IP 192.168.190.20.44251 > one.one.one.one.domain: 10498+ A? cloudflare-dns.com. (36)
23:45:29.495356 IP 192.168.190.20.44251 > one.one.one.one.domain: 23052+ AAAA? cloudflare-dns.com. (36)
23:45:29.543853 IP one.one.one.one.domain > 192.168.190.20.44251: 10498 2/0/0 A 104.16.249.249, A 104.16.248.249 (68)
23:45:29.543863 IP one.one.one.one.domain > 192.168.190.20.44251: 23052 2/0/0 AAAA 2606:4700::6810:f9f9, AAAA 2606:4700::6810:f8f9 (92)
```

Any suggestions on what might be going wrong or how to fix this? Thanks.

**Comment by mansuf** [comment]
Are you using v1.0.0 and upgraded from v0.3.4 and v1.0.0 ?

If yes, you need to update requests and dnspython

```
pip install -U "dnspython[doh]==2.6.1" "requests[socks]==2.32.3"
```

**Comment by limkokhole** [comment]
Thanks for the response. It remains the same despite my installing it from a clean virtual environment:

```
xb@dnxb:~/Downloads/dns/doh$ virtualenv -p /usr/bin/python3 venv
created virtual environment CPython3.8.10.final.0-64 in 149ms
  creator CPython3Posix(dest=/home/xiaobai/Downloads/dns/doh/venv, clear=False, no_vcs_ignore=False, global=False)
  seeder FromAppData(download=False, pip=bundle, setuptools=bundle, wheel=bundle, via=copy, app_data_dir=/home/xiaobai/.local/share/virtualenv)
    added seed packages: pip==23.3.2, setuptools==69.0.3, wheel==0.42.0
  activators BashActivator,CShellActivator,FishActivator,NushellActivator,PowerShellActivator,PythonActivator
xb@dnxb:~/Downloads/dns/doh$ . ./venv/bin/activate
(venv) xb@dnxb:~/Downloads/dns/doh$ echo $PYTHONPATH

(venv) xb@dnxb:~/Downloads/dns/doh$ python3 -m pip install requests-doh
Collecting requests-doh
  Using cached requests_doh-1.0.0-py3-none-any.whl.metadata (2.8 kB)
Collecting requests==2.32.3 (from requests[socks]==2.32.3->requests-doh)
  Using cached requests-2.32.3-py3-none-any.whl.metadata (4.6 kB)
Collecting dnspython==2.6.1 (from dnspython[doh]==2.6.1->requests-doh)
  Using cached dnspython-2.6.1-py3-none-any.whl.metadata (5.8 kB)
Collecting h2>=4.1.0 (from dnspython[doh]==2.6.1->requests-doh)
  Using cached h2-4.1.0-py3-none-any.whl.metadata (3.6 kB)
Collecting httpcore>=1.0.0 (from dnspython[doh]==2.6.1->requests-doh)
  Using cached httpcore-1.0.5-py3-none-any.whl.metadata (20 kB)
Collecting httpx>=0.26.0 (from dnspython[doh]==2.6.1->requests-doh)
  Using cached httpx-0.27.2-py3-none-any.whl.metadata (7.1 kB)
Collecting charset-normalizer<4,>=2 (from requests==2.32.3->requests[socks]==2.32.3->requests-doh)
  Downloading charset_normalizer-3.3.2-cp38-cp38-manylinux_2_17_x86_64.manylinux2014_x86_64.whl.metadata (33 kB)
Collecting idna<4,>=2.5 (from requests==2.32.3->requests[socks]==2.32.3->requests-doh)
  Downloading idna-3.8-py3-none-any.whl.metadata (9.9 kB)
Collecting urllib3<3,>=1.21.1 (from requests==2.32.3->requests[socks]==2.32.3->requests-doh)
  Downloading urllib3-2.2.2-py3-none-any.whl.metadata (6.4 kB)
Collecting certifi>=2017.4.17 (from requests==2.32.3->requests[socks]==2.32.3->requests-doh)
  Downloading certifi-2024.8.30-py3-none-any.whl.metadata (2.2 kB)
Collecting PySocks!=1.5.7,>=1.5.6 (from requests[socks]==2.32.3->requests-doh)
  Downloading PySocks-1.7.1-py3-none-any.whl.metadata (13 kB)
Collecting hyperframe<7,>=6.0 (from h2>=4.1.0->dnspython[doh]==2.6.1->requests-doh)
  Using cached hyperframe-6.0.1-py3-none-any.whl.metadata (2.7 kB)
Collecting hpack<5,>=4.0 (from h2>=4.1.0->dnspython[doh]==2.6.1->requests-doh)
  Using cached hpack-4.0.0-py3-none-any.whl.metadata (2.5 kB)
Collecting h11<0.15,>=0.13 (from httpcore>=1.0.0->dnspython[doh]==2.6.1->requests-doh)
  Downloading h11-0.14.0-py3-none-any.whl.metadata (8.2 kB)
Collecting anyio (from httpx>=0.26.0->dnspython[doh]==2.6.1->requests-doh)
  Downloading anyio-4.4.0-py3-none-any.whl.metadata (4.6 kB)
Collecting sniffio (from httpx>=0.26.0->dnspython[doh]==2.6.1->requests-doh)
  Downloading sniffio-1.3.1-py3-none-any.whl.metadata (3.9 kB)
Collecting exceptiongroup>=1.0.2 (from anyio->httpx>=0.26.0->dnspython[doh]==2.6.1->requests-doh)
  Downloading exceptiongroup-1.2.2-py3-none-any.whl.metadata (6.6 kB)
Collecting typing-extensions>=4.1 (from anyio->httpx>=0.26.0->dnspython[doh]==2.6.1->requests-doh)
  Downloading typing_extensions-4.12.2-py3-none-any.whl.metadata (3.0 kB)
Using cached requests_doh-1.0.0-py3-none-any.whl (13 kB)
Using cached dnspython-2.6.1-py3-none-any.whl (307 kB)
Using cached requests-2.32.3-py3-none-any.whl (64 kB)
Downloading certifi-2024.8.30-py3-none-any.whl (167 kB)
   ━━━━━━━━━━━━━━━━━━━━━━━━━━━━━━━━━━━━━━━━ 167.3/167.3 kB 2.2 MB/s eta 0:00:00
Downloading charset_normalizer-3.3.2-cp38-cp38-manylinux_2_17_x86_64.manylinux2014_x86_64.whl (141 kB)
   ━━━━━━━━━━━━━━━━━━━━━━━━━━━━━━━━━━━━━━━━ 141.1/141.1 kB 1.9 MB/s eta 0:00:00
Using cached h2-4.1.0-py3-none-any.whl (57 kB)
Using cached httpcore-1.0.5-py3-none-any.whl (77 kB)
Using cached httpx-0.27.2-py3-none-any.whl (76 kB)
Downloading idna-3.8-py3-none-any.whl (66 kB)
   ━━━━━━━━━━━━━━━━━━━━━━━━━━━━━━━━━━━━━━━━ 66.9/66.9 kB 1.7 MB/s eta 0:00:00
Downloading PySocks-1.7.1-py3-none-any.whl (16 kB)
Downloading urllib3-2.2.2-py3-none-any.whl (121 kB)
   ━━━━━━━━━━━━━━━━━━━━━━━━━━━━━━━━━━━━━━━━ 121.4/121.4 kB 2.8 MB/s eta 0:00:00
Using cached h11-0.14.0-py3-none-any.whl (58 kB)
Using cached hpack-4.0.0-py3-none-any.whl (32 kB)
Using cached hyperframe-6.0.1-py3-none-any.whl (12 kB)
Downloading anyio-4.4.0-py3-none-any.whl (86 kB)
   ━━━━━━━━━━━━━━━━━━━━━━━━━━━━━━━━━━━━━━━━ 86.8/86.8 kB 1.8 MB/s eta 0:00:00
Downloading sniffio-1.3.1-py3-none-any.whl (10 kB)
Downloading exceptiongroup-1.2.2-py3-none-any.whl (16 kB)
Downloading typing_extensions-4.12.2-py3-none-any.whl (37 kB)
Installing collected packages: urllib3, typing-extensions, sniffio, PySocks, idna, hyperframe, hpack, h11, exceptiongroup, dnspython, charset-normalizer, certifi, requests, httpcore, h2, anyio, httpx, requests-doh
Successfully installed PySocks-1.7.1 anyio-4.4.0 certifi-2024.8.30 charset-normalizer-3.3.2 dnspython-2.6.1 exceptiongroup-1.2.2 h11-0.14.0 h2-4.1.0 hpack-4.0.0 httpcore-1.0.5 httpx-0.27.2 hyperframe-6.0.1 idna-3.8 requests-2.32.3 requests-doh-1.0.0 sniffio-1.3.1 typing-extensions-4.12.2 urllib3-2.2.2

[notice] A new release of pip is available: 23.3.2 -> 24.2
[notice] To update, run: pip install --upgrade pip
(venv) xb@dnxb:~/Downloads/dns/doh$ python3
Python 3.8.10 (default, Jul 29 2024, 17:02:10) 
[GCC 9.4.0] on linux
Type "help", "copyright", "credits" or "license" for more information.
>>> from requests_doh import DNSOverHTTPSSession
>>> session = DNSOverHTTPSSession(provider='cloudflare')
>>> r = session.get('https://google.com')
```

**Comment by mansuf** [comment]
Did the problem appears only for this version or this problem affect all versions ?

Because i test it on virtual environment too, freshly installed requests-doh and test it and it works 

**NOTE**: For this test case, my ISP doesn't allow access to porn websites because the goverment doesn't allow it.

```
G:\requests-doh>type test.py
import traceback
from requests_doh import DNSOverHTTPSSession, __version__

print(__version__)

def main():
    session = DNSOverHTTPSSession()
    try:
        r = session.get("https://www.pornhub.com")
        # r = session.get("https://www.reddit.com")
    except Exception as e:
        print("Error: ", e)
        traceback.print_exception(e)
    else:
        print(r.status_code, r.url)



if __name__ == "__main__":
    main()
G:\requests-doh>python test.py
1.0.0
200 https://www.pornhub.com/
```

**Comment by mansuf** [comment]
Looking your output from `tcpdump` command, the DoH is working. Your network sends dns request to cloudflare-dns from port 53 which means it the dns request for google.com is not in port 53 but in port 443 (DNS over https)

**Comment by limkokhole** [comment]
However, 192.168.190.20:60893 > one.one.one.one.domain with port 53 connects to 1.1.1.1:53 using UDP. When I use netstat, it clearly shows:

(venv) xb@dnxb:~/Downloads/dns/doh$ python3
Python 3.8.10 (default, Jul 29 2024, 17:02:10) 
[GCC 9.4.0] on linux
Type "help", "copyright", "credits" or "license" for more information.
>>> from requests_doh import DNSOverHTTPSSession
>>> session = DNSOverHTTPSSession(provider='cloudflare')
>>> r = session.get('https://google.com')
>>> 


xb@dnxb:~/Private/con.sys/m3u8$ sudo tcpdump -i wlo1 port 53
tcpdump: verbose output suppressed, use -v or -vv for full protocol decode
listening on wlo1, link-type EN10MB (Ethernet), capture size 262144 bytes


01:32:02.199807 IP 192.168.190.20.60893 > one.one.one.one.domain: 9530+ A? cloudflare-dns.com. (36)
01:32:02.199825 IP 192.168.190.20.60893 > one.one.one.one.domain: 35640+ AAAA? cloudflare-dns.com. (36)
01:32:02.200031 IP 192.168.190.20.51286 > one.one.one.one.domain: 53357+ PTR? 1.1.1.1.in-addr.arpa. (38)
01:32:02.226980 IP one.one.one.one.domain > 192.168.190.20.51286: 53357 1/0/0 PTR one.one.one.one. (67)
01:32:02.227220 IP 192.168.190.20.40287 > one.one.one.one.domain: 8626+ PTR? 20.190.168.192.in-addr.arpa. (45)
01:32:02.227355 IP one.one.one.one.domain > 192.168.190.20.60893: 9530 2/0/0 A 104.16.249.249, A 104.16.248.249 (68)
01:32:02.227374 IP one.one.one.one.domain > 192.168.190.20.60893: 35640 2/0/0 AAAA 2606:4700::6810:f9f9, AAAA 2606:4700::6810:f8f9 (92)
01:32:02.263352 IP one.one.one.one.domain > 192.168.190.20.40287: 8626 NXDomain* 0/1/0 (100)


![1725730397_2024-09-08_e578peLbxO](https://github.com/user-attachments/assets/098e4b41-74d8-4de0-97f4-043b7026bd01)

**Comment by limkokhole** [comment]
I think it still reads from my /etc/resolv.conf, which lists 1.1.1.1 at the top, despite my setting the provider to 'Google.' Shouldn't requests_doh ignore my /etc/resolv.conf and use the hardcoded Google DNS IP?

```
>>> session = DNSOverHTTPSSession(provider='google')--- SIGWINCH {si_signo=SIGWINCH, si_code=SI_KERNEL} ---
--- SIGWINCH {si_signo=SIGWINCH, si_code=SI_KERNEL} ---
>>> session = DNSOverHTTPSSession(provider='google')
>>> r = session.get('https://bing.com')
openat(AT_FDCWD, "/usr/lib/python3.8/__pycache__/netrc.cpython-38.pyc", O_RDONLY|O_CLOEXEC) = 3
openat(AT_FDCWD, "/usr/lib/python3.8/__pycache__/shlex.cpython-38.pyc", O_RDONLY|O_CLOEXEC) = 3
openat(AT_FDCWD, "/home/xiaobai/.netrc", O_RDONLY|O_CLOEXEC) = 3
openat(AT_FDCWD, "/home/xiaobai/Downloads/dns/doh/venv/lib/python3.8/site-packages/certifi/cacert.pem", O_RDONLY) = 3
openat(AT_FDCWD, "/home/xiaobai/Downloads/dns/doh/venv/lib/python3.8/site-packages/dns/__pycache__/resolver.cpython-38.pyc", O_RDONLY|O_CLOEXEC) = 3
openat(AT_FDCWD, "/home/xiaobai/Downloads/dns/doh/venv/lib/python3.8/site-packages/dns/__pycache__/_ddr.cpython-38.pyc", O_RDONLY|O_CLOEXEC) = 3
openat(AT_FDCWD, "/home/xiaobai/Downloads/dns/doh/venv/lib/python3.8/site-packages/dns/__pycache__/nameserver.cpython-38.pyc", O_RDONLY|O_CLOEXEC) = 3
openat(AT_FDCWD, "/home/xiaobai/Downloads/dns/doh/venv/lib/python3.8/site-packages/dns/__pycache__/asyncquery.cpython-38.pyc", O_RDONLY|O_CLOEXEC) = 3
openat(AT_FDCWD, "/home/xiaobai/Downloads/dns/doh/venv/lib/python3.8/site-packages/dns/rdtypes/__pycache__/svcbbase.cpython-38.pyc", O_RDONLY|O_CLOEXEC) = 3
openat(AT_FDCWD, "/home/xiaobai/Downloads/dns/doh/venv/lib/python3.8/site-packages/dns/rdtypes/__pycache__/util.cpython-38.pyc", O_RDONLY|O_CLOEXEC) = 3
openat(AT_FDCWD, "/home/xiaobai/Downloads/dns/doh/venv/lib/python3.8/site-packages/dns/__pycache__/reversename.cpython-38.pyc", O_RDONLY|O_CLOEXEC) = 3
openat(AT_FDCWD, "/etc/resolv.conf", O_RDONLY|O_CLOEXEC) = 3
openat(AT_FDCWD, "/home/xiaobai/Downloads/dns/doh/venv/lib/python3.8/site-packages/certifi/cacert.pem", O_RDONLY) = 3
openat(AT_FDCWD, "/etc/nsswitch.conf", O_RDONLY|O_CLOEXEC) = 3
openat(AT_FDCWD, "/etc/host.conf", O_RDONLY|O_CLOEXEC) = 3
openat(AT_FDCWD, "/etc/resolv.conf", O_RDONLY|O_CLOEXEC) = 3
openat(AT_FDCWD, "/etc/ld.so.cache", O_RDONLY|O_CLOEXEC) = 3
openat(AT_FDCWD, "/lib/x86_64-linux-gnu/libnss_files.so.2", O_RDONLY|O_CLOEXEC) = 3
openat(AT_FDCWD, "/etc/hosts", O_RDONLY|O_CLOEXEC) = 3
openat(AT_FDCWD, "/etc/ld.so.cache", O_RDONLY|O_CLOEXEC) = 3
openat(AT_FDCWD, "/lib/x86_64-linux-gnu/libnss_mdns4_minimal.so.2", O_RDONLY|O_CLOEXEC) = 3
openat(AT_FDCWD, "/lib/x86_64-linux-gnu/libresolv.so.2", O_RDONLY|O_CLOEXEC) = 3
openat(AT_FDCWD, "/etc/ld.so.cache", O_RDONLY|O_CLOEXEC) = 3
openat(AT_FDCWD, "/lib/x86_64-linux-gnu/libnss_dns.so.2", O_RDONLY|O_CLOEXEC) = 3
openat(AT_FDCWD, "/etc/gai.conf", O_RDONLY|O_CLOEXEC) = 3
openat(AT_FDCWD, "/home/xiaobai/Downloads/dns/doh/venv/lib/python3.8/site-packages/dns/rdtypes/IN/__pycache__/__init__.cpython-38.pyc", O_RDONLY|O_CLOEXEC) = 4
openat(AT_FDCWD, "/home/xiaobai/Downloads/dns/doh/venv/lib/python3.8/site-packages/dns/rdtypes/IN", O_RDONLY|O_NONBLOCK|O_CLOEXEC|O_DIRECTORY) = 4
openat(AT_FDCWD, "/home/xiaobai/Downloads/dns/doh/venv/lib/python3.8/site-packages/dns/rdtypes/IN/__pycache__/A.cpython-38.pyc", O_RDONLY|O_CLOEXEC) = 4
openat(AT_FDCWD, "/etc/resolv.conf", O_RDONLY|O_CLOEXEC) = 4
openat(AT_FDCWD, "/home/xiaobai/Downloads/dns/doh/venv/lib/python3.8/site-packages/certifi/cacert.pem", O_RDONLY) = 4
openat(AT_FDCWD, "/home/xiaobai/Downloads/dns/doh/venv/lib/python3.8/site-packages/dns/rdtypes/IN/__pycache__/AAAA.cpython-38.pyc", O_RDONLY|O_CLOEXEC) = 4
openat(AT_FDCWD, "/home/xiaobai/.netrc", O_RDONLY|O_CLOEXEC) = 5
openat(AT_FDCWD, "/etc/resolv.conf", O_RDONLY|O_CLOEXEC) = 5
openat(AT_FDCWD, "/home/xiaobai/Downloads/dns/doh/venv/lib/python3.8/site-packages/certifi/cacert.pem", O_RDONLY) = 5
openat(AT_FDCWD, "/home/xiaobai/Downloads/dns/doh/venv/lib/python3.8/site-packages/dns/rdtypes/ANY/__pycache__/CNAME.cpython-38.pyc", O_RDONLY|O_CLOEXEC) = 5
openat(AT_FDCWD, "/home/xiaobai/Downloads/dns/doh/venv/lib/python3.8/site-packages/dns/rdtypes/__pycache__/nsbase.cpython-38.pyc", O_RDONLY|O_CLOEXEC) = 5
openat(AT_FDCWD, "/etc/resolv.conf", O_RDONLY|O_CLOEXEC) = 5
openat(AT_FDCWD, "/home/xiaobai/Downloads/dns/doh/venv/lib/python3.8/site-packages/certifi/cacert.pem", O_RDONLY) = 5
>>>
```

**Comment by limkokhole** [comment]
I think I misinterpreted it. It first sends a request to 1.1.1.1, which is specified in my /etc/resolv.conf, to get the IP address of cloudflare-dns.com. Then, it queries https://cloudflare-dns.com/dns-query using port 443. Thanks.

**Comment by limkokhole** [comment]
I recommend hardcoding trusted IPs such as 1.1.1.1 for initial DoH queries to directly connect to DNS services, circumventing any potential DNS manipulation by ISPs.
